,cmp,adv,dadv
0,씨제이씨지브이(주),"대기업이라 아르바이트도 수당을 다 챙겨줘서 좋아요 재미있어요 대기업이라는 이름 자체가 주는 긍정적인 느낌이 있으며, CJ계열사를 할인받아 이용 가능한 장점이 있다. 연차를 위눈치 안봐도 되고 카페테리아가 같이 있기때문에직원할인가로 커피를 즐길 수 있고 또한 휴식공간으로 활용할 수 있습니다 퇴직금, 연차, 공휴일 수당, 영화관람무료, 매점할인정도? CJ 계열에서 복지를 누릴 수 있는 장점과 선진화된 인사시스템(실제 인사 운영부서는 최악)이 장점입니다. 무엇보다 CJ 타이틀이 앞에붙는것 외에는 매출도, 성장성도 제로입니다. cj의 복지를 같이 누릴 수 있다. 영화를 공짜로 볼 수 있다. 비슷한 나이대 많아서 알아가는 사람들도 많고 인맥이 넓어져요 업무 분담 체계가 확실하다. 깐깐할 수 있지만 체계를 잘 지키면서 일하게 된다 취업 전 아르바이트 경험으로는 최고의 아르바이트. 여러 사람을 만날 기회가 있다 대기업이다보니 정확히 뗄 거 다 떼고 수당같은 건 모두 다 챙겨줌 아르바이트인데도 연차수당 꼭꼭챙겨줌 당연함. 유연한 근무교대가 가능함.미소지기용 어플이 따로있어서 편리함 여러 사람들을 만나면서 즐겁게 20대를 보낼 수 있는 그런 아르바이트. 일도 그렇게 어렵지는 않다 연차를 마음대로 사용 가능함 일하는 만큼 벌 수 있고 휴식시간도 잘지켜짐 국내 1등 회사이기에 일하는 보람을 느낄수 있습니다. 업무 체계가 나름대로 갖춰져 있는 편이다.젊은 분위기대체로 활발하고 재밌는 사람들이 많은 편이다.제한된 선 내에 영화를 무료로 감상할 수 있고, 매점 할인 이용이 가능하다. CJ계열사의 체계적인 매뉴얼이 있어 서비스 대응을 수월하게 진행할 수 있었다. 연차 자유로움, 탄력적인 출퇴근 시간(부바부), 대기업 야근 수당, 추가 수당 등 다 잘 챙겨주고  월급날 맞춰서 꼬박꼬박 들어온다. CJ계열로 계열사 할인, 여행 등의 복지가 좋음.비교적 님문화가 잘 정착된 계열사인편. 아르바이트 치고 복지도 괜찮은 편이고, 인간관계 늘리는게 굉장히 좋은 편입니다.성격 또한 외향적인 성격으로 바꾸기도 쉽습니다. 한 달에 영화 10편 무료 복지.. 매점도 50% 할인인데 이제는 그냥 알바생한테 돈을 쓰게 하려는 수작처럼 보임... 늦게 퇴근하면 야근수당 당연한 거지만 안 챙겨주는 데가 많다보니 이것도 장점처럼 보이더라 ... 연차를 윗사람 눈치 안보고 쓸 수 있음. 대기업 계열사라 복지는 나쁘지 않은편. 마일리지 쏠쏠히 사용 가능. 복지가 괜찮음 서비스직에서 근무한 결과 고객을 우선 생각한다. 오만가지 사업을 하는 CJ답게 복지포인트로 오만가지를 누릴 수 있음.대기업이잖음. 가오산다는거 만으로도 어마어마한 이득. 스케줄 근무, 3, 5, 7, 10년차 휴가 제공, 계열사 40% 할인, 월 20회 영화 무료 할인규모는 확실히 후하다. 내가 받는 혜택이 애사심을 불러주는 사내 마케팅의 최고 예시. 근무 스케줄이 유동적입니다.전국 CGV 본인 영화 무료로 볼수있습니다.         매점 50% 할인이 됩니다. ㅎㅎ 연차 발생, 월급 밀리지 않음, 연장시 수당, 야간 수당 지급과 교통비 지급 다른 사이트는 모르겠으나, 내가 지금까지 다녔던 사이트들은 칼출근, 칼퇴근 가능 영화관 3사 씨지브이 롯데시네마 메가박스 중에 제일 좋다 생각합니다. 영화 쿠 폰 그거 말곤 없음 사람 많이 없는 지점은 좀 쉴수 있음 유동적인 근무시간 조정 가능하꼬 또래 근무자가 많이 모여있는 만큼 사람 사귀기에 좋다 일의 난이도는 쉬운편 그래도 돈은 꼬박꼬박 나오고, 복지적인 부분이 아무래도 대기업이다보니까 그 점은 좋다 라고 생각이 들었다. 사회적 인식 포함? 근태 급여가 좋고, 근무 교대가 수월하여 아르바이트로는 적절하다. 영화 콘텐츠를 좋아하는 사람들에게 있어 실적이나 트렌드 분석에 흥미를 느낄 수 있음.모기업 복지 혜택극장 무료 관람 아르바이트생에게 연차 발생이 되고 사용할 수 있다는 건 정말 최고의 복지인 것 같다. 스케줄이 유동적이라 원하는 시간에 맞게 근무할 수도 있고 나이대가 비슷한 사람들과 일을 하기에 즐겁게 일할 수 있으며 때때로 보람을 느낀다. 서비스 뿐만이 아닌 재고나 물류들을 다루는 법 또한 세세하세 알 수 있음. 오티티 사업의 확장으로 무너질것이라 예상했지만 극장만이 가지는 아이덴티티로 오랜 기간 건재할것으로 예상 근무시간 잘지켜져서 근무외시간에 할것을 계획하기에좋다 CJ그룹의 복지 혜택(계열사 40프로 할인, 해외여행 숙박비 카페테리아 지원 등) 비교적 잘 지켜지는 워라벨과 직원 연령대는 젊은편. 복리후생은 많이 줄긴 했으나 현재 상태로도 만족(카페테리아, 올리브영 할인 등) 연차 사용, 복지 포인트 자율 사용. 백신 휴가 등 기본은 지킴. 워라벨은 팀바팀. 워라벨이 좋은 부서는 정말 전혀 눈치 안보고 퇴근할 수 있음. 유연근무제도 본사에만 해당되긴 하지만 눈치 안보고 쓸수 있는편","아르바이트 생이 자주 바뀌어서 오래 근무한 사람들은 좀 힘들 수 있어요 업무량이 많아요 이제는 영화를 영화관이 아닌 집에서도 편하게 볼 수 있는 시대가 오다보니 더이상 영화로서 기업이 더 커지는 방향은 없을 수도 있을 듯 함. 그 외의 먹거리에 대한 고민이 큼. 또한, 삼교대라는 게... 너무 피곤함. 주 52시간 근무제로 인한 컴퓨터가 자동으로 꺼지는 시스템으로 이루어져 있어 시간 부족현상이 일어납니다 심한 점바점 사바사, 추락하고 있는 영화 업계, 미소지기 갈아 넣는 인력 단점이 한 두개가 아니라 매우 안타깝습니다. 우선 본사는 부바부이나, 리더들이 무능력하고 능력이 있어도 로열티가 매우 낮아 이직준비만 하고있습니다. 현장이나 지점의 경우는 체력과 건강을 담보로 근무중임. 잦은 조직개편과 비효율적인 보고 프로세스, 업무분담이 제대로 되지 않으며 워라밸이 없다. 비슷한 나이대가 많아서 관계때문에 그만두거나 퇴사하는 친구들도있어요 비효율적인 일들이 가끔 이해가 안될 때가 있어서 그 점은 힘들다ㅜ 점점 망해가는 영화관... 사람도 많이 안오고 근무 스케쥴도 정해진게 아니라 시간 맞추는 게 힘들다 위에ㅜ장점 빼고 다스케줄 근무라는 것이 가장 큰 단점 지점 바이 지점우리지점은 아르바이트생의 꼭대기에 있는 선임들이 편애가 심했다.,자기들이 이뻐하는애들은 챙겨주고 아닌애들은 까내리고아르바이트라서 어린친구들이 많아서 그런지 뒷말이 많음 일의 강도는 점바점이기는 하지만 사람 많이 몰려오면 최저시급 받으면서 일하는게 맞나 싶은 알바 매니저님 점장님 영향에 따라 하루, 분위기가 너무 달라짐 너무 비효울적 직무 이동과 성과중심 업무만 고치면 좋겠습니다 위탁관에서 일했고 모든 위탁관이 그런 건 아니겠지만 월급날이 주말이면 원래 그 전에 지급되어야 하는데 그 이후에 지급되었다. 사바사 케바케지만 어떤 환경이든 결국 인간관계에서 문제가 발생할 수 있다는 점을 다시 한번 깨닳고 간다. 단순 보고를 위한 문서 작업이 많음, 연봉이 적음, 정치가 남아있음 교통비 지원이 너무 적다.. 타 경쟁사랑 비교해도 터무니 없이 적고 식대 지원을 해줬으면 좋겠다. 일을 위한 일이 많음. 규정과 절차를 지키라고 말하면서 규정을 제대로 알고 설명해줄 사람이 없음. 식사는 따로 제공되는게 없어서 자비로 해결해야되는게 가장 큰 단점이었고, 고정근무가 아니라 스케줄근무라 단점이 좀 있습니다. 관리자가 커뮤니케이션을 너무 비효율적으로 함. 최저시급 주면서 시키는 일이 너무 많음. 화장실 체크해야 함. 현타옴. 그리고 CCTV로 알바생 감시하는 거 불법인데 왜 자꾸 감시하고 무전하는지... 미소지기, 매니저, 고객 관리 3박자가 어렵다. 사내정치도 심한편. 많이 체계적이라서 조금만 실수해도 눈치가 보인다. 분위기가 조금 딱딱함 복지대신 연봉이 짬.관리쪽이라면 업종이든 뭐든 다른 업체가 훨씬 좋음. 재무적으로 쓰러져가는 회사한동안 임금 상승 없었음미래 먹거리에 대한 뚜렷한 방안이 아직 없음 아직까진 오래된 사이트에 현장은 옛날식 근무환경이 있다. 요즘과 맞지않아 그만두는사람이 보였는데 현장은 사내 조직문화에 적용시키기 어려운걸 수도..? 성수기에 사람이 몰리다보니 근무 강도가 조금 높아 힘들수도 있습니다. 간혹 진상 손님을 만날수도 있습니다.. 야간 교통비가 적다. 식대 안 나옴. 영화 본인만 관람 가능 매년 받는 평가가 점장이 주고싶은대로만 줌, 챙겨주고 싶은 사람만 챙겨줌 적자를 보고있는 상태라 그게 흠이라면 흠 이제 흑자로 돌아서는 기점이라 생각 눈치 사람많이 몰리면 힘듬빡셈 하루 종일 서있어야하는것 장점이자 단점 사람이 너무 많아 간혹 정치 혹은 뒷얘기가 생길수있음 좀 군대 느낌을 많이 받았습니다. 1분이라도 어기면 안되는 그런 깐깐함.. 코로나 이후 업무하는 사람이 줄어서 극심한 인력난에 시달렸다. 수 년전부터 잡고 있는 위 세력들로 인해 고여 있는 문화정체된 문화코로나로 인해 산업 자체가 작아진 모양새 그래도 현장직이다 보니 어쩔 수 없이 바쁜 성수기에 육체적 피로가 쌓인다. 아르바이트에게 주인의식을 요구하는 바보같은 기업.. 그러면 복지를 늘려주세요~ 딱히없지만 적어야한다면 멀티로 처리해야할일이있을때 바빠진다는것이다 본사 현장 서로 욕하기 바쁨일체 소통이 안되는 답답한 구조 보고를 위한 보고. 불필요하게 많은 결재라인. 아직도 잔존하는 꼰대문화와 그들에게 아첨떠는 박쥐같은 직원이 상당 수 존재 연봉동결, 연봉 인상 낮음, 로열티 있는 직원이 거의 없음. 보고를 위한 업무가 많은편임. 급여가 그렇게 높지 않은 편"
